class,khaiii_text
갈취 대화,내일모레 더 준비 이번 달 이미 원하 금액 다 맞추 드리 사이 금액 상하 가 있 그때그때 상황 알 정말 이번 달 드리 다 현금 더 만들 만들 없 정 말 이제 자리 잡 딸자식 앞길 망가뜨리 보네 살리 딸 건들 아 이렇 부탁 하 듣어주나 다음 달 어떻 채우 이번 살리 제발 돈 없 몸 때우 몸뚱이 돈 벌어먹 살 제발 이번 보
직장 내 괴롭힘 대화,어 제 길동 사원 회사 배달 시키 먹 하 회사 업무 있 너무 늦 시간 진행 허기지 저녁밥 시키 길동 사원 안 쓰 럽 소리 알 있 그렇 일 못 하 어울리 사람 업무 속 환멸 나 어제 밥 먹 속 싫 먼저 먹 얘기 꺼내 길동 사원 말씀 너무 지나 치 맞 말 하 못 사람 아무것 안 하 맞 밥 먹 싫 하 잖 눈치 없 아직 못 느끼 그렇 생각 유감 그렇 생각 님 밖 없 아우 착각 심하 밖 없 문제지 사람 눈 밖 나 모르 자신 잘나 알 떵떵거리 재수 없 잘못 갑자기 이러 말씀 참고 이유 없 그냥 말 목소리 듣 싫 짜증 나 제발 알 관두 좋 제발 사라지 안 되
직장 내 괴롭힘 대화,님 너무 짜증 나 저렇 하 모르 말 하 마음대로 님 님 일 그만두 이렇 하 모르 물어보 죠 쯧쯧 다시 하 빨리 하 알
기타 괴롭힘 대화,술 마시 좌 송합 남자 친구 있 어 때 남자 친구 지금 없 아 튕기 같이 마시 왜 이러 술 마시 얘기 아존나비 싸 구네 같 좀 놀 자 어깨 손 치우 더럽 가 얼굴 못생기 꼴 값 떠 가 제발
기타 괴롭힘 대화,알 요즘 유튜브 유명 기절 놀이래 하 왜 해 위험 친구 없 그 러 하 하 무서 워 씨 잠깐 기절 깨 그 위험 사례 나오 장난 열받 가만히 있 애 들 얘 좀 잡 놓 제발 지마 그러 일 등신 같 가 싫
직장 내 괴롭힘 대화,강 과장 지금 졸 부장 어제 야근 좀 하 사람 이러 평가 나쁘 아침 졸 어떻 되 이번 달 마무리 프로젝트 야근 어머 과장 어 제 야근 어제 지갑 놔 오 사무실 다시 오 안 계시 사람 거짓말 능력 없 안 자르 옆 두 그만두 부장 야근 밥 먹 다시 사무실 돌아오 말 맞 치 업무 이렇 개판 졸 기 하 인정 그만두 부장 제발 나가 집 노모 어린아이 있 나가 집식구 어떻 하 사정 회사 보 주 되
기타 괴롭힘 대화,돈 갚 빌리 없 새끼 저번 빵 주 남 주 주 증인 있 다 봄 물건 받 돈 주 안 맞 정신 차리 잡 미안 내일 가져오 이미 늦 새끼 땀나 인건비 가져오 알 미안
직장 내 괴롭힘 대화,소문 들 소문 팀 김주 임이 팀 이 주 임 그렇 맞 소문 길 주임 유부남 저번 보 탕비실 쑥덕거리 확인 사실 말 괜히 엮이 말 다니 괜히 이미지 나쁘 이주임 여우 같 스탈 가까이 두 마
갈취 대화,새로 오 찌질 전학 누 세 학년 선배 가방 예쁘 보이 안 보 지금 빨리 집 가보 잠깐 보 빨리 별거 없 진짜 대 맞 싫 가방 내놓 털 나오 진 짜 별거 없 진짜
갈취 대화,만 있 알 없 돈 있 빌리 알 돈 빌리 지금 차비 없 빌리 싫 사람 부탁 방금 지갑 현금 많 보 빌리 그렇 어렵 현금 많 적 고 상관 좋 말 때 주 좋 안 참 악 진정 빨리 내놓 알 알
갈취 대화,오랜만 경수 빌리 싫 제발 당장 급하 다음 달 갚 믿 어리 친구 옛날 얘기 지금 돈 빌리 연락 하 죽 그러 치졸 정말 알 마지막 부탁 이후 돈 빌리 연락 안 할 부탁 제발 이렇 연락 마 마지막 고맙 정말 계좌 번호랑 보내 보 낼 진정 친구 정말 고맙 경수
기타 괴롭힘 대화,세상 요지 경 요즘 애 안 가지 개새끼 가 쓸개 다 빼주 기세 말 젊 처지지 개 옷 사 입히 정말 개 팔자 상팔자 아주 상 전 상 전 강 저러 애 안 낳 나라 망하 망하 어르 그냥 강아지 산책 갑자기 그러 때 개새끼 다 두드리 맞 묶 키우 사람 다니 등산 길 개새끼 데려오 정말 없 어르신 마스크 똑바로 쓰 지금 코로 난리 지금 마스크 똑바로 안 쓰 나 무라 보 바르 나라 말세
직장 내 괴롭힘 대화,김 대 리 좀 대신 제거 다 하 시간 뒤 제출 되 먼저 부탁 하 일 있 장난 상사 하 하 과장 과장 님 하 미치 하 싫 그만두 사장 여쭈 잘못 보 보 하 일 하
갈취 대화,빌리 있 이제 하 없 이번 진짜 급하 크 아버지 병원 계 신대 빌리 병원 가보 빌리 가족 문 제 열받 빌리 진짜 열 받 사람 발 못 연인 사이 물건 집어던지 마 욕 하 좋 말 하 빌리 서로 좋 진짜 마지막
기타 괴롭힘 대화,보이 멋 있 시계 만지 볼래 본적 없 모르 있 안 되 후원 받 들어가 야 되 열심히 살 열심히 살 돈 들어오 어 냄새 씻 나다니 옷 옷 일주일 동안 입 촌
직장 내 괴롭힘 대화,김 대 리 복사 복사 아까 하 또 말 꾸 상사 하 하 알 김 대 리 점점 기어오르 같 말 여 깄 과장 파 하 복사 하 말대답 하 하 아니꼽 알
협박 대화,형 오늘 돈 주 하 하 약속 안 지키 하루 뒤 미루 없 오늘 안 주면 하 장기 좋 말 하 때 가져오 정말 하루 뒤 가져오 있 하루 정말 화나 지금 당장 장기 하나하나 다 떼주 니 어떻 구하 오늘 안 들일
기타 괴롭힘 대화,진짜 할아버지 보호자 안 찾아오 할아버지 먹 싸 바쁘 아휴 냄새 진짜 할아버지 아무것 하 시 그냥 잠 주무 얌전 버르장머리 없이 말 이쁘 하 이러 자식 버리 성격 그렇 무식 자식 좋 찾아오 젓 돈 벌 짓 같 할아버지 같 성격 가지 부모면 진 작 버리
직장 내 괴롭힘 대화,대리 일 처리 하 하 하 일 대리 일 처리 제대로 못 알리 아이 대리 일 처리 못 잘 배 우 인정받 잘 다 지금 부서 실적 떨어지 안 보이
직장 내 괴롭힘 대화,부장 오늘 반차 쓰 안 되 아프 몸살 심하 같 병원 좀 가 빨리 들어가 보 감사 가 김 대리 몸살 나 반 차 쓰 집 가리 말 안 하 하 부장 말씀 드리 말 하 회사 돌아가 진 짜 아주 개판
갈취 대화,윤 대리 연필꽂이 있 펜 산 펜 이 소리 펜 쓰이 이니셜 뱃속 있 태명 이니셜 남편 하 야 알 사람 이니셜 똑같 있 지금 의심 겁 윤 대리 책상 위 있 선풍기 알 윤 대리 도벽 있 남 물건 훔치 다니 그 렇 그 렇 진짜 어이없 증거 있 사람 몰아가 선풍기 외국 내 기념품 사 오 대리 있 일 없 어쩌 잃어버리 사람 잘못 잘못 겁 빨리 돌리 기념일 맞 만들 의미 있 있 하 원래 지금 쓰 소유 주장 내 가져가 원래 물건 가 가져오 하 원래 소유 쓰 사람 있 가져가 싫 말 진 짜 더럽 빨리 내놓 도둑 새끼 완전
기타 괴롭힘 대화,놀라 재미있 재미있 재미없 진 짜 놀라 알 재미있 재미없 겁 많 갑자기 놀라 안 좋아하 조심 친구 장난 좀 치 가지 왜 이렇 정색 장난 장난 정말 놀라 말 야 나 급 재미없 꽉 막히 친구 옆 있 숨 막히 나중 결혼 성격 신랑 대차 이혼 말 그렇 하
기타 괴롭힘 대화,비키 미안 미안 말 앵무새 말 모르 살짝 치 넘어지 매가리 없 못 먹 그렇 맞 집 가난 가난 부모 버리 도망가 할머니 살 소문 있
협박 대화,동생 자폐 하 짓 웃기 동생 있 동생 있 생방 나가 진짜 무사 같 지금 협박 동생 목숨 손 달리 원하 그렇 나오 원하 알 안 하 동생 죽이
기타 괴롭힘 대화,어렵 부탁 오빠 사회 생활 하 하 폰 남자 번호 지 우 사회생활 못 핑계 대지 마 핑계 오빠 없 남자 친구 선배 말 남자 친구 선배 필요 과제 하 학과 일 있 과제 하 과대 같 때려치우 정말 지치 오빠 너무 의심 심하 진작 거짓말 안 하 연락 잘 되 이러 미안 하 지금 헤어지 지우 지우 되
협박 대화,옆 마을 김 할머니 그렇 사이 소문 내 소리 저번 있 보 지나가 그냥 우연히 스치 지나가 씨불이 모르 할망구 사이 아주 모르 남 집 가정 파탄 내 다리 뻗 잘 생각 알 진짜 세 열 받 확 다 조지 얄밉 면상 아스팔트 문대 버리 전 입 물 진짜 세 오해
직장 내 괴롭힘 대화,고졸 부르 일 오 보 고졸 검정 고시 개천 용 나오 하 알 있 회의 자료 준비 니 인턴 맡기 커피 타 주 알 너무 주눅 들 마 회사 생활 하루아침 부장 커피 타 오
협박 대화,엄마 이러 되 엄마 하 하 나이 이러 엄마잖 자식 하 있 엄마 하 하 돈 나쁘 길 가 되 이제 인생 엄마 살 진짜 돈 없 죽 도와주 사고 더 수습 없 아빠 얘기 다 되 돈 안 주 다 죽이 그렇 있
협박 대화,자식 학교 시험 따 점수 받아 아빠 배 물 좀 차 보 골프채 뒤지 맞 되 어 제 중간고사 치 성적표 가져오 용서 자식 계속 다 머리 나쁘 대가리 터트리 아빠 머리 나쁘 공부 더 열심히 하 잘못 아빠
기타 괴롭힘 대화,듣 몰골 좀 씻 다니 걸레 물 뿌리 다 알 화장 고치르 있 곳 오 맞 갑자기 젖 하 더러 빨리 꺼지 두 병신년 도대체 왜 이러 잘못 있 그냥 당하 표정 너무 재밌 이유 그냥 싹 꺼지
기타 괴롭힘 대화,따르 하 따르 하 따르 하 목소리 정말 웃기 반 저능 흉내 어우 저능아 지능 딸리 집 박히 굳이 기 나오 귀찮 구 괴롭히 생기 재밌 인정 제발 만
갈취 대화,범생 돈 있 없 돈 나오 대 뒤지 필통 숨기 내놓 돈 나 깡패 때리지 대신 내일 배 가지 오 용서 용서 돈 없 거짓말 정말 최악
직장 내 괴롭힘 대화,과장 이사 축 하드 고맙 오늘 집 오 선물 준비 빈손 오 되 니 굳이 선물 사 그러 저번 과장 집 주 부담 선물 그 그 렇 말 와이프 애 친정 가 오늘 집 가 시 퇴근 가 있 집 엉망 말 하 울 없 어렵 그렇 알 퇴근 주차장 보세 알
협박 대화,일 책임 좀 짓 작년 맡 경찰서 가 오 싫 힘들 같 사람 살아보 죽 낫 사장 잘 책임지 잘 제발 부탁
협박 대화,더 기회 주 잘못 어쭈 잘 생각 일분 생각 칼 찌르 살리 닥치 식구 보 용서 안 정말 잘못
직장 내 괴롭힘 대화,하 김 사 원 씨 발 지금 하 짓 못 보 지금 팔팔 끓 물 붓 지금 하 빨리 청소 안 하 미끄러지 어쩌 빨리 못 지금 놀이터 장난
직장 내 괴롭힘 대화,김 대 리 작업 하 아주 엉망 초등학생 거 잘 이렇 뽑 안 되 인사 팀 어쩌다 뽑 송 하 부모 이렇 알 시 말 못 가 제대로 다시 하 알
갈취 대화,하 늘 아 쇼핑 갈 래 쇼핑 웅 애 쇼핑 가 끼 고맙 고맙 놀 내 되 무리 어울리 무시세 같 학생 있 싫 말 알 다음 주 수학여행 가 다니 제주도 가 알
갈취 대화,이 강민 되 미안 미치 에 어팟 사 그렇 어렵 이번 달 용돈 다 주 봐 안 아빠 내일 안 사 오 두 보 제발 승우 다음 달 사 있 닥치 엄마 지갑 털 사와 라 안 사 오 동생 만들 알 알 사 오 제발 동생 건들 마 꺼지 알 제발 동생 건들
기타 괴롭힘 대화,이렇 몸 털 많 유전 부모 털 많 꼭 원숭이 같 지능 낮 거구 지금 하 맞 원숭이 닮 진화 덜 되 지능 그렇 원숭이 같 지능 낮 찐따 하 제발
직장 내 괴롭힘 대화,간호사 어제 채혈 다 하 산소 측정 다 하 퇴근 다 마무리 못 어제 다 친절 알리 선배 말씀 너무 빠르 잘 이해 안 되 길 말 다 직접 하 알 지 말 배우 다 그렇 배우 그렇 배우 되 선배 그렇 하 환자 케어 눈 그렇 똑바로 치 다보 어제 하 일 마무리 선배 똑바로 하 어제 정시 퇴근 같 초짜 말 간 더 배우 퇴근 못 그러 말 모르 새기 들
갈취 대화,와 이 프 이쁘 제발 저 이야기 나누 지장 찍 갑자기 그러 어떡하 그냥 와 이 프 다시 못 보 지 요구 하 가게 안 돈 가 져 시간 더 주 와이프 다시 보 싫 어떻 구하
직장 내 괴롭힘 대화,오 안 하 과장 근무 시작 신입 빠지 때 오 멀 곳 자취 하 그렇 일찍 오 버스 시간 더 일찍 일어나 되 빠지 다 잘 되 하 일 맞 내일 지켜보 일찍 오 업무 배우 시정
직장 내 괴롭힘 대화,김 대리 남자 친구 있 남자 친구 잘생기 남자 친구 잘 있 물어보 상사 팀원 사생활 알 업무 일환 남자 친구 며칠 되 사람 묻 말 하
직장 내 괴롭힘 대화,김 대 리 못 후배 하 고치 고생 알 말 못 하 정신 나가 제대로 하 보 살 하 때려치우 정말
협박 대화,조심 하 알 알 말 소리 더 하 그러 오 죽이 두 보
직장 내 괴롭힘 대화,이번 주 하 김 사 원 딱히 별일 없 집 쉬 잘 되 이번 주말 삼촌 가평 갈빗집 열 손 부족 하 저랑 젊 때 갈빗집 알 바 하 면접 보 때 생각나 오랜만 적성 살리 갈비 먹 바람 쐬 좋 힘들 같 별일 없 하 요새 젊 사람 정 없 정 앞 정 없이 칼 대하 세
협박 대화,나 네 웬일 지금 딸 데리 있 모르 묻 덕분 집 풍비박산 나 잘못 애초 그렇 조작 다 필요 없 저승길 가 외롭 딸 가 왜 딸 죄 없 이제 죽 생기 죄 소용 가 제발 해코지 하 딸 내버리 딸 생사 전화 알리 맘 변함 없 끊
갈취 대화,조용히 하 소리 지르 죽 누 세 이러 닥치 뒤 돌 엎드리 가만히 묶이 되 이제 집 값지 물건 다 가져가 불만 없 이러 겁 생각 쓰 많 숨기 있 말 숨기 없 집 이제 아무것 없 있 금고 새끼 거짓말 치 네 비밀 번호 불 안 죽
기타 괴롭힘 대화,기사 양반 내려주 여기 정류장 나이 먹 걷 힘들 내려 가 내려 다시 걸어오 안 사 루신 업 걸 오 얼른 내려주 그렇 막무가내 나오 안 왜 안 되 갓길 세우 되 가 내려 드러눕
갈취 대화,이리 오 보 저요 돈 필요 좀 주 그러 돈 주 제정신 돈 없 돈 있 같 가방 주 낡 겁
직장 내 괴롭힘 대화,어제 스투파 네 완전 재미있 까르륵 정말 빠지 대화중 들 이렇 재밌 얘기 갑자기 배 아프네 화장실 가 맞 박 대리 부장 부르 빨리 가보 맞 빨리 가요 일어나 같이 가요 신 대리 방금 전 스투파 얘기 엄청 좋아하 유사원 회사 놀 이터 친구 예능 프로 얘기 하 방금 말씀 같길 하 얘기 엿듣 되 기분 나쁘 유사원 예의 없 눈치 더 없 그러 말 일 못 눈치 있
기타 괴롭힘 대화,수급자 어쩐지 냄새 나 소리 더럽 동네 더럽 집 더럽잖 보 꼭 보 편견 오 하 거지 꼭 지 거지 하드라 왜 그렇 못 그렇 말 나쁘
직장 내 괴롭힘 대화,럽 맛있 식사 되 팀장 맛있 들 김 대리 맛있 먹 사원 밥 들어가나 입사 언젠데 아직 일 처리 엉망 거래처 안 좋 말 나오 아 제대로 하 천천히 밥 먹 시간 업무 꼼꼼히 확인
협박 대화,하 부딪치 사과 안 하 새끼 무시 때리 죽이 다시 안 그 럴 그렇 알 때리 같 각오 그만 하세 여자 너무 심하 새끼 여자 다 보 주 똑같 치 미치 죽 죽 새끼
협박 대화,헤어지 죽 지치 진짜 죽 꼴 보 죽 죽 죽 기다리 죽이 죽 미치 소리 연락 마 미치 소리 원룸 그대로 살 찾아오 마 경찰 신고 오 전 다 죽이 상관없 미치 새끼 지금 협박 신고
기타 괴롭힘 대화,서류 좀 공증 규정 구비 서류 없 해 없 알 화 나 하 없 부분 곤란 말 위 위 상사 말씀 드리 해드리 어렵 부분 빠지 위 불러오 말씀 지나 치 손 왕 모르 잠 시 기다리
갈취 대화,일 오 보 보 젓 말 말 있 넵 길동 고등학교 철수 동생 이지 넵 형 아세 길동 조르 하 말 가방 주 가방 왜 형 우 예쁘 동생 공부 열심히 가방 보 왜 버릇없 에잇 머리 때리 있 핸드폰 좋 지갑 사 임당 대박 새끼 집 사 보네 개꿀 이제 주 학원 가 하 공부 열심히 하 형 돈 폰 빌릴 안 폰 얼마 전 시험 하 받 돈 학원비 새끼 형 친구 빌릴 형 친구 친구 새끼
직장 내 괴롭힘 대화,이 리 오 선배 눈치 없 출근 과장 부장 커피 한잔 내려 선배 커피 잔 들 구 막내 예의 아냐 지금 눈 동그랗 뜨 하 지금 사회 생활 가르치 기분 상하 선배 반응 하 출근 하 선배 과장 부장 커피 좀 드리 그렇 아니꼽 우 우습 절대 선배 진짜 말 안 하 눈치 없 생각 알리 태 도하 앞 지켜보 행동 똑바로 하
직장 내 괴롭힘 대화,오늘 저녁 해 저녁 하 오늘 몸 안 좋 어렵 같 아프 그냥 컨디션 안 좋 아프 술 한잔 좋 술 먹 더 안 좋 같 냐 소주 비타민 타 먹 좋 오늘 쉬 안 되 진 짜 이렇 인사 평가 시즌 이러 되 냐 알 해
직장 내 괴롭힘 대화,김 선생 이따 저녁 하 일정 없 원장 선생 그렇 잘 되 김 선생 남 일 좀 하 되 일 래 별 연수 받 대신 온라인 괜찮 부탁 김 선생 원장 선생 같 김 선생 예쁘 보 정도 하 같
직장 내 괴롭힘 대화,어제 맛있 드 너무 맛있 덕분 잘 먹 길동 기분 안 좋 있 없 전 보 가 단도직입 로 묻 아버지 회장 자격지심 느끼 대하 태도 기분 탓 맞 불만 있 말 하 기분 나쁘 행동 드러내
협박 대화,잘 지내 보이 있 알 숨기 있 알 제발 제발 아이 안 아파하 보 원하 원하 늘 먹 약속 있 하 보 아이 꽤 귀엽 가지 이러 창피 전혀 아직 받 많 제발 구하 기 여 주
협박 대화,이쯤 포기 오 공 들이 그러 없 공 들이 돈 많이 들 날 죽이 목숨 가치 없 넘기 생명 하 그 러 없 아저씨 아들 중하 가요 나쁘 안 되 안 안 하 알 생각 시간 다오
직장 내 괴롭힘 대화,자식 식판 밥 풀 무식 옛날 태어나 머슴 하 자식 오 밥맛 떨어지 맛있 들 다 먹 남 그만 먹 일 더럽 못밥 축내 사람 보이 회사 있 좋 밥 못 먹 눈치 없 법 있 무식 밥 엄청 푸 먹 걸 맞 욕하 눈치 없 얘기 알
직장 내 괴롭힘 대화,오늘 회식 마음껏 먹 횟집 시키 오징어회 먹 오징어 오징어 오징어 시키 가 오징어 친구 먹 오 수족관 있 농담 이렇 눈 동그랗 뜨 재미없 웃
갈취 대화,포켓몬 카드 좋 글치 나주 아끼 주 아빠 사 말 카드 카드랑 바꾸 싫 허접 대 맞 그냥 주 래
협박 대화,지난 여름 하 일 알 거짓말 치 남자 친구 믿 친구 믿 정말 알 연락 없 그날 대하 남자 친구 메 세지 보내 되 원하 이더리움 끌 더 올리 준비 가져오 알
갈취 대화,시은아 학원비 내 주 안 되 안 진 짜 돈 없 진짜 돈 없 비상금 있 돈 진 짜 쓰 안 되 그냥 달 갚 돈 없 이렇 지질 굴 알 알 하 앞 잘 진짜 마지막
기타 괴롭힘 대화,점장 부르 일 옷 사 옷 터지 환불 영수증 보이 빨리 그냥 고객 영수증 없 환불 어리 우 같 찢어지 옷 그냥 입 영수증 가져오 교환 환불 때 안 나가 고객
기타 괴롭힘 대화,아프 아프 해지 매애 대패 크크 이번 긋 재미있 크크 붙잡 재미없 무섭 무섭 칼 문신 만들 멋 있 칼빵 오른쪽 왼쪽 애꾸눈 싫 놓 싫 하 도망 가게
협박 대화,기장 이제 말 경로 비행 안 관제 탑 교신 하 잘못 비행 기 충돌 비행기 폭발 말 안 하 지금 비행기 폭파 말 비행 관제탑 미리 교신 여기 현 비행기 납치 비행 경로 바꾸 부탁 지금 몽골 가 빨리 전하 몽골 가 있 빠르 답변 부탁 드리 현재 몽골 크 태풍 상륙 예정 비행 어렵 하 죽 안 말 하 루트 알아보 조짐 보이 리모컨 보이 누르 비행기 공중분해 하 좀 진정 갑자기 경로 바꾸 란 명령 하 마 명령 다시 회화 죽 터뜨리 괜찮 경로 찾 가 겁 좀 기다리 오늘 비행기 승객 많 당황 시 키 면 큰일 납 제발 살리
갈취 대화,젓 말 목걸이 비싸 보이 목걸이 내놓 목걸이 선물 받 안 돈 주 살 목걸이 내놓 목걸이 말 드리 필요 없 목걸이 내놓 목걸이 정말
직장 내 괴롭힘 대화,대리 지금 자나 부장 늦 시간 일 내일 딸아이 취업 면접 보 가 정장 세탁소 안 찾 보 왜 전화 대리 집 세탁 소 가깝 니 지금 가 세탁 물 찾아오 부장 지금 가족 행사 오 조금 있 찾 가 안 되 다음 달 승진심사 엉망 되 지금 말 무시 승진 막 있 부장 안 용서 자식 두 우습 본대 치르
기타 괴롭힘 대화,달라붙 마 너 다니 왕 당해 피 하 마 친구잖 친구 그냥 보이 데리 다녀 생각 같 애랑 친구 뇌 없 만 있 많이 사 맛있 사 다 친구 웃기 그냥 돈 줄이
협박 대화,칼 내려놓 무시 선생 진정 말 좀 들 죽이 선생 이러 안 되 못 하 같 자꾸 이러 있 모두 위험 못 쓰 경찰 부르 해
협박 대화,도저히 상황 안 말씀 기간 마련 생각 무조건 이번 달 하 입 내뱉 말 잊 목숨 바치 일 하 면목 없 다 말 지키 집 함부로 놀리 되 보이 씨 발 말귀 못 알 처먹 좋 말 하 라오 정말 자꾸 비굴 굴 형 어차피 죽 말 잘 듣 빨리 가 살리 다음 주 일 있 꼭 가져오 다 다음 주 내일 준비 안 되 손가락 먼저 잘리 알
협박 대화,알바 지원 맞 이리로 오 되 따라오 알 오 알바 랑 다르 착오 있 위험 일 그냥 있 사람 감시 고 되 짓 요 사람 빨리 풀 하 겁 사람 살 맞나 그냥 하 돈 많이 챙기 아르바이트 생기 알 합 그냥 못 척 안녕히 계 세 그렇 안 눈 똑똑히 보 있 죽 정도 때리 재우 알 그냥 하 그러 돈 많이 주 땡 이러 하 이러 친구 알 오 말 오 장 소 움직이 되 안 그러 혈액 눈 콩팥 정도 필요 하 다행 죽이 하 하 살리 안 죽이 안 죽이 눈 없 죽 콩팥 없 안 죽 눈뜨 하 하 돈 많이 줄
협박 대화,쌀 쌀맞 이혼 소송 도중 연락 짐 가져가 지금 가 되 왜 이렇 재촉 입 옷 다 있 어떡하 문밖 내놓 알 가 지 가 너무 문밖 내놓 자식 앞 집 살 안 보 이제 오 딴소리 되 자식 생각 하 아빠 노릇 하 되 잠깐 이 지금 짐 이제 짐 주 집 안 보 보 없 빨리 나가 웃기 정말 가 물 잔 마시 다 마시 빨리 이대로 가 알 마지막 기회 줄 이혼 취소 칼 찔리 싫 자식 위하 다시 부부 지내 미치 하 짓 놓
직장 내 괴롭힘 대화,과장 저번 빌리 가방 내일 돌려주 있 봉이 경질 필요 빌리 기억 안 나 이러심 안 되 과장 안 안 부탁 드리 돌려주 빌리 기억 없 과장 정말 이러 겁 이렇 사람 잡 지 가 일 하
직장 내 괴롭힘 대화,부장 보 가져오 새끼 일 처리 진짜 못 하 다시 하 자꾸 실수 지 똑바로 못 반항 시위 지금 부장 제대로 하 대리 하 알 점심시간 밥 처먹 밖 없 회사 도움 안 되 더 열심히 일 새끼 자꾸 말꼬리 잡 네 그냥 닥치 가 하 대리 승진 싫 이번 심사 평가 다 받 부장 잘 하 이러 그냥 계속 대리 대리 좋 자리 가 못 보 같
협박 대화,술 가져오 어제 마시 그만 마시 술 가져오 가져오 죽 마취총 쏘 하 마취총 쏘 기절 죽이 일 왜 이 렇 하 계속 반항 진짜 죽 집 죽 알 하 같 술 가져다주 되 가지 하 가져오 왜 이렇 말대꾸 죽 애 있 말 쉽 애새끼 다 같이 죽 그만 어떻
갈취 대화,연예인 이정우 님 마약물 하 증거 입수 지금 언론 퍼뜨리 이정우 님 힘들 알 소리 알 해킹 그러 서로 서로 피곤 주 돈 많이 있 퍼뜨리 진짜 한태 이러 죄 지 그러 마약 하 마약 청정국 연예인 면 마약 하 병원 잘못 처방 받 중독 원하 알 서로 좋 좋 넘어가 입금 하
갈취 대화,안녕 친구 농구공 농구 아 보 친 한척 해 농구 가 길 목마르 음료수 마시 슈퍼 길 지 형 아들 목 마 르 네 돈 빌리 있 밖 없 센터 까 더 나오 한대 정말 거 없 나중 형아 맛있 사 줄 우유 많이 마시 키 많이 커 안녕
협박 대화,그러 분명히 가석방 하 그제 원 영감 말 많 시끄럽 잠 잡 형 죄 짓 다 같 국가 죄 꺼 새끼 같 얼른 처 죽 국가 좋 명 기 시 방 한 교 진짜 교도소 있 흔적 없이 죽이 입 달리 털 부러 오늘 잠자 때 조심 하 손모가지 사라지 후회 말 형 농담 지나 치 어뜨 형 밥 먹 때 도 조심 히 안 섞이 모르 명 짧 조심 허 아 따 빨리 조용히 잠자 모가지 틀 쓰
기타 괴롭힘 대화,아까 지켜 이상형 번호 좀 주 남자 친구 있 에이 거짓말 진짜 골키퍼 골 안 들어가 되 친구 싫
갈취 대화,돈 있 없 원 대 다 내놓 진짜 없 내일 만원 가져오 초등학생 그렇 큰돈 있 문제집 살 하 가져오 알 내일 한시 와 안 오 나중 되 알 알
협박 대화,시키 일 제대로 못 죽 죽 말 하 딸 있 이러 안 되 딸 랑 먼저 사 라질 모르 잘 하 보 이번 잘 감사
직장 내 괴롭힘 대화,물 마시 시간 있 너무 목 타 입 찬물 위아래 있 들 일찍 말 커피 타올
갈취 대화,뒤지 싫 내일 돈 들 오 드라마 못 보 깐부 잖 장 난치지 마 장난 치 보이 내일 돈 만들 오 협박 신고 신 하 학교생활 고통 하 돈 없 부모 돈 받 전단지 돌리 어떻 구해 내일 알
직장 내 괴롭힘 대화,한율 마감 좀 하 마감 아직 안 끝내 지금 신랑 앞 기다리 어쩌 조금 더 기다리 하 미안 오늘 시어머님 생신 가 보 하 늦 혼 얼른 집 가 한율 집 기다리 사람 없 마감 대신 진짜 정떨 어지 구 서로 힘들 때 돕 살 동료 안 대리 힘들 상황 보 한율 사무실 비호감 데리 놀 모르 다 싫어하 한율 안 내일 사무실 더 살벌 다니 그냥 하
