class,khaiii_text
직장 내 괴롭힘 대화,강인 턴 대학 나오 묻어보 실례 려 아유 실례 길동 정보 고등학교 출신 길동 정보 특성 고등학교야 대학 졸업 좋 기회 특성 학생 전형 회사 입사 되 자랑 말 진짜 회사 돌아가 똥통 애 뽑 일 뽑 맞 그러 중위 학 나오 보 싫 고졸 채용 요즘 고졸 애 알 그냥 월급 받 도둑놈 보 다 열심히 하 일 야무지 소리 많이 들 걱정 안 하 되 겁 야무지 고졸 뽑 배우 느리 서연 졸업 애 뽑 더 이 득 알 알 그러 발톱 가 진 짜 벌써 스트레스받 애 끼 팀 분위기 다 망가 특성 화면 양아치 다니 학교 중학교 수학 못 때 모 애 다니 곳 좋 곳 취업 애 많 중학교 내신 높 들어오 애 많 그러 정규 직 하청 업체 공장 들어가 취업 높 광고 늘 또박또박 말대답 벌써 진절머리 나 네 최대한 열심히 하
갈취 대화,정도 돈 없 선생 몸 캠리 공짜 아 그냥 서로 합의 오늘 자정 그때 입금 안 하 선생 지인 사진 배 포 들얼가 안 드리 깎 지금 깎 일 창녀 사도 비용 지불 야동 사도 비용 지불 자본주의 사회 돈 천 싸 먹히 신고 선생 신고 다 해킹 해킹 잖 선생 가족 직장 동료 친구 선생 알몸 보 서로 원만히 합의 낫
직장 내 괴롭힘 대화,대리 보고서 다시 제출 대리 사람 놀리 다시 써 고치 일일이 말 대리 생각 없 다시 하 대리 진 짜 독 보 못 쓰 회사 손실 나 책임지 부장 다 새끼 대학 졸업 개 새끼 짖 부장 제발
직장 내 괴롭힘 대화,새끼 말 빠져 회사 성적 말 되 닥치 말 팀장 팀장 실력 적어도 지금 절대 시작 전 솔직히 말 영화 팀원 다 보 이제 영화 보 걸리 해 끝나 똑같이 해 부장 너무 하 끝나 위치 추적 하 개인 정보 침해예 회사 군대 개인 팀 일 안 되 해
직장 내 괴롭힘 대화,한주 주말 뭐 하 대구 본 내리 가 잘 되 집 거창 알 아네 알 주말 오가 좀 태우 집 가 일 있 차 카시트 지 너무 많 자리 없 치우 불편 가 되 대신 이야기 재밌 가 되 와이프 애 불편 같 더 불편 가족 사이 끼 그날 보
갈취 대화,돈 있 없 어 제 용돈 받 사 있 상관 주 돈 없 굴욕 사진 단톡방 뿌리
기타 괴롭힘 대화,친구 만나 마 고등학교 때 친구 만나 마 왜 그 더 중요 텐 없 만나 마 싫 그 전 대학교 친구 만나 하 이제 랑 연 끊기 지금 고등학교 친구 착하 얘 그렇 헤어지 이제 안 만날 진짜지 싫 안 하 고맙 역시 텐 없 없
직장 내 괴롭힘 대화,수 민 팀장 커피 사 오 수민 그렇 당당 정말 사실 말씀 드리 수 민 사무실 외부 커피 마시 짬 되 왜 이리 요 즘 애 개념 없 개념 어제 야근 하 피곤 그러 에잉 쯧 나가 팀 커피 사 오 있 입 입 입 주둥 돈 아깝
협박 대화,제대로 안 하 미안 사과 필요 없 오늘 안 보내 내일 기다리 있 진짜 미안 오늘 힘들 같 죽 진 짜 친구 죽 원하 오늘 밤 라 안 친구 제발 건들 약속 부탁 원하 다 하 하 되 친구 살 보장 보내 확인 수틀리 친구 자르 인증 최대한 노력 조금 기다리 중간 연락 끊기 뒤지
기타 괴롭힘 대화,야 돼지 급식소 돼지 빼 더 있 피자 빵 들 가 안 먹 나중 먹 돼지새 형 다이어트 시키 다이어트 그렇 마 내놓 살 빼 이리 주 이리 주 살 빼 새끼 형 잘 먹
기타 괴롭힘 대화,원 플러스 원 고객 행사 지난주 끝나 원 플러스 원 계산 고객 하 없 없 없 값 받 되 고객 임의 계산 하 없 번호 남기 행사 안 내드 되 안 오 만족 드 융통 없 일 하
기타 괴롭힘 대화,지금 웃 방금 보 웃 카톡 보 웃 비 다리 핫바지 아나 정말 쩡말입미 시비 거 시 겁 대비 거 시 겁 시비 걷 어쩔 어쩌 하 폭행 고소 겁
기타 괴롭힘 대화,처먹 그만 처먹 씹 왜 러 걷 다니 때 바닥 울리 왜 그러 엄마 돼지 엄마 욕하 마 완전 돼지 가족 진짜
기타 괴롭힘 대화,스타일 번호 점 싫 존 튕기 싫 물어보 존 비싸 굽 네 비싸 굴 전번 좀 주 남자 친구 있 주 없 친구 지내 전화번호 좀 주 싫 왜 자꾸 전화번호 달 하 주 때 휴대폰 안 주 주 휴대폰 주세 요
협박 대화,커피 머리카락 들어가 환불 처리 시끄럽 손 대하 기본 안 되 그렇 때리 폭행 교육 보 폭행 더 맞 자꾸 그러 경찰 부 르 진짜 정신 못 차리 지금 뜨겁 주전자 쏟 주 살리 시끄 러 이미 경찰 부르 모르 알 어차피 인생 망하 화상 입히 하 살리
직장 내 괴롭힘 대화,대리 거 맞 음 다시 하 째입 다시 하 일 말 많 다시 하 하 되 잘 해 머리 좀 굴리 구체 머리 없 안 체
직장 내 괴롭힘 대화,조부장 요새 부서 분위기 괜찮 어쩌 일 감찰관 조부장 얼굴 보 오 감찰관 너무 보 그치 역시 조부장 그나저나 저번 업무 보 중간 새 그렇 조부장 이리 긴장 가볍 물어 요번 딸 학교 입학 조부 장 친지 인사 일 있 아마 예 예 있 그 딸아이 입학 졸업 부탁 앞 조부장 부서 확실히 뒤 보 어떻 하하하
협박 대화,제발 그만 때리 안 되 아직 정신 못 차리 못 눈물 우정 이 아 관하 소문내 안 그 때리 애 들 제발 때리 안 되 시키 하 어렵 일 싫 그냥 더 맞 그냥 때리
협박 대화,왜 오 죽 다시 돌아오 가지 야 가지 오 멀 가지 오 있 그렇 얼른 들 나가 오 때 맘대로 들 오 가 때 맘대로 못 가 애 들 막 진짜 이제 아무것 진짜 미치 같 죽 되 알 제발 부탁 살리 제발 나가 싫 다리 부러 틀이 나가 걱정 제발 그러 마 잘못 살리 잡 도끼 가져오
직장 내 괴롭힘 대화,영희 거 안 똑바로 하 옷 되 말 말 대답 제대로 하 눈 안 깔 아주 기어오르 아주 다지
협박 대화,친구 말 있 오랜만 보 이리 진지 모 드 고민 있 야 자식아 친구 좋 얼른 불 보증 빼 다 도와주 장난치 말 보 날 바다 죽이 자수 자신 있 부모 속초 계시 접 때 가 물 좋 사 부모 다시 뵙 싫 부탁 친구
직장 내 괴롭힘 대화,김 대 리 있 과장 담배 밖 얘기 다 아직 안 집 오늘 안 가 과장 제 발요 그러 월급 받 하 얘기 하 놓 알
기타 괴롭힘 대화,그만 따라오 말 아까 계속 따라오 우연히 방향 같 거짓말 멈추 서 때 똑같이 멈추 걸음 가 연예인 병 계속 따라오 신고 가 길 그러 웃기 아가씨 계 속 같 방향 오 모르 알 몰카 찍 하 신고 일 없
갈취 대화,일 오 보 젓 말 아무것 없 쓰 다 내놓 진짜 없 집 가난 털 나오 죽 진 짜 없 진 짜 화나 하 드리 보내
직장 내 괴롭힘 대화,팀장 마무리 되 무리 주말 다 작성 되 알 다 마무리 주말 하 아직 다 아직 다 어떡하 과장 오늘 하 말 하 전달 못 받 오늘 팀장 전달 못 자리 없 과장 되 오늘 다 마무리 보내 퇴근 늦 생기
직장 내 괴롭힘 대화,오늘 남 오늘 안 가 가 남 이유 말 뒷담 까 다니 말씀 듣 알 몰아가 몰아가 재밌잖 대하 말 상사
기타 괴롭힘 대화,시간 되 술 한잔 해 아 바 쁘 못생기 비싸 꺼지
갈취 대화,빌리 전 빌리 안 준대 갚 빌리 진 짜 못 빌리 러 비밀 지키 고맙 다 말 안 되 줄 꼭 갚 땡큐
기타 괴롭힘 대화,화채 시키 사람 먹 보내 문제 화채 들어가 과일 커팅 하 모양 이상 한입 커팅 나가 문제 고치 되 환불 고객 서비스 왜 이 맘 진 짜 안 들 송 하 고객
갈취 대화,김꼬봉 돈 있 얼마 전 책 사 돈 없 주머니 뒤지 나오 진짜 뒤지 맞 음 사실 김 코봉 돈 있 맞 만 래 그냥 빌리 빌리 친구 기부 인 마 꼭 필요
기타 괴롭힘 대화,이번 주 집 비우 부모 계시 비우 하 요즘 덜 맞 빠지 미안 대꾸 하 하 말씀 드리 보 보 무조건 알 어 미안
직장 내 괴롭힘 대화,부장 연차 내 되 안 부장 되 연차 못 쓰 아들 학교 체육 대회 있 아빠 노릇 하 부탁 드리 부장 안 소리 일 하 저번 내 아이디어 부장 안 드리 이러 겁 도대체 그러 사람 장난 알 진짜 괴롭히 부장 고정 오 심 하 승진 누락 인사 평가 아주 거지 같 거지 같 오늘 잘못 걸리 이번 연도 고 내년 후년 승 진 꿈 꾸 마 이름 걸 막 좋 회사 발 나가
갈취 대화,알 빨리 튀 어 안녕 안녕 앞 날 처맞 다닐 지금 있 돈 폰 가지 다 내놓 핸드폰 봐주 안 되 말 꾸 정도 새끼 반 반 앞 자주 보 너무 싹수 없 보
기타 괴롭힘 대화,하 목도리도마뱀 재밌 하 싫 안 하 하 싫 재호 많이 크 하 싫 개 길 알 최재호 화나 빨리 싫 싫 자꾸 강요 뇌 밖 빠지 찐따놈 개기 철민 잡 오케 싫 싫 만지 마 제발 해 흑흑
직장 내 괴롭힘 대화,김 모 라 선배 어제 옷 입 출근 같 옷 입 출근 회사 이미지 있 가방 너무 짝퉁 티 나 옷 가방 어 때 같 일 창피 러 좀 신경 쓰 다니 말씀 너무 심하 크 맘먹 충고 고마워하 어휴뭐 다 있
갈취 대화,지은아 코인 노래방 가게 빌리 책 사 돈 없 그러 원 주 안 진짜 용돈 받 없 갚 원 없 뻥 치 빌리 진짜 없 믿 빌리 좋 말 하 때 빌리 진짜 없 안 놀 빨리 내놓 알
기타 괴롭힘 대화,리뷰 이벤트 하 하 안 하 연락 드리 그렇 오늘 리뷰 이벤트 있 바쁘 오늘 이 부탁 드리 지금 하 미치 맘 고객 다르 약속 보내 머 그냥 주 약속 하 정신 못 차리 지금 일 하 정신 차 기분 나쁘 들리 오늘 리뷰 이벤트 부탁 드리 싫 싫 차단 하 알
기타 괴롭힘 대화,있 지금 바쁘 가 빵 사 오 갑자기 배고프 빵 사 오 가 되 말 많 오 사 오 크림 빵 부탁 바쁘 로 가 오 배고프 가 되
기타 괴롭힘 대화,야 야 수진 바 람피우 걸리 소리 바람 피우 소문 다 나 이미 걸레 바 람피우 어쩌 걸 레야 이제 학교 대표 걸레 되 진짜 사실 모르 소문 믿 그러 처신 잘 그 렇
직장 내 괴롭힘 대화,다 지금 가 일 다 끝나 다 혜 일 끝나 다 끝나 다 바쁘 일 안 보이 도 있 업무 그냥 자리 있 도와주 대리 같 있 도움 되 다 일 그렇 나가 직원 사기 떨어지 대리 이번 지 내내 야 근하 사람 야근 안 하 다 맨 날 연봉 받 허드렛일 하 이렇 사회 생활 못 하 다혜 씨 프로젝트 하 대리 상관없 일 상관없 이렇 눈치 없 아주 그냥 내일 오 마
기타 괴롭힘 대화,이렇 뚱뚱 그냥 모르 상관 싹수없 봐 시비 걷 뚱뚱 돼지 같 돼지 냄새 나 억지 있 제발 꺼지 그러
협박 대화,눈 똑바로 뜨 다 쇼 길 가 사람 치 사과 먼저 나오 앞 똑바로 안 보 다니 부딪히 보 사과 말 똑바로 하 걸어가 사람 어깨 치 가 싸가지 죽 사람 죽 이뇨 인성 나 오 네 사람 긁 있 집 주소 부르 그냥 오늘 가 불지르 올라 자꾸 로 협박 자리 경찰 부르 부르 잡히 들어가 전 집 찾아가 가족 싹 죽이 올 답 없 사람 네
기타 괴롭힘 대화,이리 초면 다짜고짜 예의 밥 말 먹 행동 하 다 무시 무시 술 취하 같 술 취하 곱 가 같 관심 가지 주 별것 깝죽거리 얼굴 인정 꼬시 개매 존나 하네 미친년 맞 악 도와주 같 맞 정신 차리 제발 살리
기타 괴롭힘 대화,지금 딸 밀 놀 끼어들 어른 말 진 짜 말 지금 눈 보 거짓말 지 짜 안 밀 놀 오 넘어지 쪼 끌 못 지 놀이터 전세 내 놀 오 끼어들 그러 그냥 친구 놀 넘어지 빨리 딸 사과 못 넘어뜨리 진 짜
기타 괴롭힘 대화,게 그 부정 안 하 보 맞 보 얘 게이 맞 진짜 더럽 더럽 완전 왜 그렇 살 으 옆 있 마 잘못 왜 그냥 그렇 태어나 잘못 이 야 그냥 가 말 섞 싫
협박 대화,음식 머리카락 나오 환불 손 보 업소 다 머리 위생모 쓰 머리카락 떨어지 일 없 염색 없 넣 말 말 머리카락 들어가 경우 없 알리 겁 어떻 망 신 주 죽 영업 방해죄 신고 전 나가 경찰 부르 한마디 더 하 시발 나이프 네 찌르 먼저 영업방해 업소 머리카락 들어가 일 없 사정 오늘 기분 안 좋 잘 걸리 이 리 오 죽이 그러 손 있 난동 부리 진정 환불 환불 개 주 무서워하 말 움직이 죽이 무릎 꿇 싹싹 빌
기타 괴롭힘 대화,얼굴 그렇 생기 얼굴 다운 증후군 걸리 애 못생 기 말 하 사실 말 기분 나쁘 야 장애인 닮 기분 파 하 웃기 똑같이 생기
기타 괴롭힘 대화,이 많이 크 그냥 찐따 멸치 새끼 알 여자 다니 알 덩치 보 여자 고릴 잘 모르 용건 말 새끼 보 학교 다니 때 처맞 살리 빌빌거리 지 분수 모르 깝죽거리 해 앞 눈 띄 깝죽거리 말 조용히 살
협박 대화,지금 하 다 밝히 겁 맘대로 잘못 세상 알리 겁 딸 마누라 목숨 안녕 같 그냥 가만히 있 죗값 치르 말귀 못 알아듣 딸 마누라 죽이 일 더 소리 하 쥐 새 모르 죽이 알
갈취 대화,길동 되 맞 숨기 자식 있 새끼 말 그렇 함부로 하 안 되 분 왜 이러 원하 내일 오전 역 물품 보관 준비 오늘 저녁 다시 얘기 잘못 알 그렇 크 돈 없 돈 없 말 상관없 알 알
갈취 대화,이번 새로 나오 핸드폰 아니 맞 제트 플립 엄마 사주 삼촌 이번 귀국 선물 못 사 오 사 대박 이 삼촌 멋 있 나주 길 떨어트리 박사 나 하 삼촌 더 받 비싸 대 글 비싸 돈 주 못 사 하 말 안 진짜 안 앞 학교생활 걱정 안 편하 안 다니 주 졸업 때 잘
직장 내 괴롭힘 대화,수정 말 까먹 말 우습 말 알아먹 이렇 잡대 뽑 지금 수정 눈 띄
협박 대화,형 장기 팔 돈 되 안 형 마 안 형 머 정난 제발 부탁 건들 장기 가져가 나 형 더 좋 형 아 프 말 제발 건들 가져가 아쉽 형 죽이 죽이 장기 가져가 그 렇 형 쓸모 없 가져가 돈 다 갚 그러기 가져가 되 필요 가져가
기타 괴롭힘 대화,선생 말 미치 놈 미안 되 더 맞 어 아프 선생 말 모르 어쩌 봐주 안 그동안 찍히 일급 찐 따 알 싸 앞 빵 더 먹 진짜 미치 빵 셔틀 하
직장 내 괴롭힘 대화,김 사원 낙하산 소문 있 요즘 시대 낙하산 있 요즘 더 하 요즘 취업 힘들 발 나가 하 크크 김 사원 이 리 오 보 진 짜 처리 똑바로 부탁 대리 대리 트집 잡 같 꼬숩네 김 사원 아직 거 깄 얼른 자리 돌아가 알 티 안 나 살살 괴롬 히
기타 괴롭힘 대화,누나 바보 누나 바보 나이 먹 말 잘 못 바보지 걷 이상 누나 그렇 말 마 야야 애 바보 동생 화내 말 너무 심하 심하 장난 정색 더 심하 있 친하 지내 이렇 나오 어렵 되
협박 대화,헤어지 장난 미안 정말 헤어지 지금 잘 하 호구 보이 호구 보이 지금 칼 얼굴 긋 있 그러 마 잘못 다시 남자 못 만나 얼굴 찢 그러 말 자꾸 경찰 신고 신고 어차피 얼굴 망가지 다음 그러 마 발
직장 내 괴롭힘 대화,김 대 리 부장 보 고 다시 쓰 고치 첨 끝 벌써 말 꾸 하 면해
기타 괴롭힘 대화,국 식 다시 하 손 다시 데우 드리 괜찮 다시 데우 래 다시 하 요금 내주 누 군지 모르 그러 같 파워블 로 거 가게 망하 꼴 보 손 이러 안 되 좋 말 하 다시 해 힘들 같 다 있 사장 데려 오 알
갈취 대화,길동 부모 맞 맞 아들 이름 알 지금 아들 옆 있 알 아들 있 돈 보내 얌전히 아들 보 낼 지금 크 돈 없 아들 안 다치 원 아들 더 얼른 보내 아들 안전 목소리 들려주 빨리 보내 이렇 지체 알
직장 내 괴롭힘 대화,더 어떻 저 근무 시간 끝나 하 일 있 싫 일 더 잘 작업 양 많 대체 더 바라 순 아 능력 있 더 일 책임감 있 많이 하 법 있 나머지 직원 인맥 들어오 마침 더 뛰어나 직원 있 하 싫 나가 너무 필요 없 나가 하 되 나가 싫 일 직원 더 늘리 진짜
기타 괴롭힘 대화,사장 배달 늦 배달원 전달 하 길 막히 늦 같 볼일 보 가 식사 늦 스케줄 정말 망치 어떡하 고객 다음 신경 쓰 더 빨리 받 있 노력 되 환불 늦 못 먹 알 고객 음식 현관 앞 걸 놓아주 걸 놓 걸 가져가 고객 안 드 셨 하 다 드시 사장 음식 찾 하도 늦 오 짜증 나 환불 안 하 별점 테러 맘 카페 다 올리 사장 안녕 배달 앱 고객 센터 배달 앱 김 고객 민원 접수 고객 사과 드리 환불 처리 진행 부탁 드리
갈취 대화,빌리 없 없 다 알 정말 뺏 미안 죽 미안
협박 대화,진짜 미안 그냥 친구 속 되 그냥 헤어지 잘못 하 미안 진심 없 안 되 알 잖 죽 보 제발 움직이 약 먹 뒤지 차도 뛰어들 죽 협박 제발 불리 목숨 가지 그러 지겹 안 지겹 붙잡 있 목숨 대수 그냥 죽 더 이상 못 하 거짓말 유서 이름 글자 적 가 죽 다 탓 대체 탓 이이
갈취 대화,서 젓 말 없 그러 주머니 사정 안 좋 말 돈 있 카드 없 좋 돈 주 되 일 어렵 만 드 뒤지 나오 진짜 돈 없 맞 가방 보이 종 돈
기타 괴롭힘 대화,언니 좀 구경 가 아저 바쁘 구경 걸리 오 늘 일 번 보 보 진짜 바쁘 보 갈 그 그 래 잘 생각 어머 언니 옷 너무 이쁘 잘 어울리 이쁘기 지금 급하 가 있 계산 하 가 되 보내주 그냥 구경 하 가 언니 말 진 짜 믿 얼른 사고 안 그럼 안 보내
직장 내 괴롭힘 대화,승진 못 알 모르 정신 상태 문제 시키 고분 고분 알 이렇 말 못 보 맨 날 그리 잘 나 부서원 협업 못 겉 돌 직원 따돌리 왕 따 당하 고 정의 사도 잘못 시정 하 시작 이 보이 상 사가 조언 하 납작 엎드리 듣 이리 말대답 싫 있 절대 승진 못 먼저 퇴사 먼저 퇴 사하 두
기타 괴롭힘 대화,아까 보 따라오 왜 따라오 지금 차 잔 약속 있 왜 이렇 비싸 굴 빨리 따라오 왜 이러 싫 남자 친구 없 아 좋 꼭 이러 싫 말 에이 확 남자 친구 없 꺼지 빨리 안 가 신고
갈취 대화,돈 내놓 알 없 다치 싫 내놓 돈 없 천호동 살 돈 없 거짓말 치 안 내놓 자리 없애 정말 지갑 두 오 보 핸드폰 내놓 핸드폰 안 계좌 이체 보내 안 그 엄마 죽 목숨 이 알 지금 보내
기타 괴롭힘 대화,아프 표정 썩 아프 미안 이제 차례 때리 안 하 래 친구 장난 못 치 유난 떨 마 때리 진짜 때리 되 정색 진짜 때리 개새끼 죽 이제 차례 악
직장 내 괴롭힘 대화,민지 님 맞나 다 회사 워크숍 있 아직 도착 전 지금 다 도착 소리 단체 메시지 못 보 장소 변경 진짜 잠시 확인 음 메시지 받 없 확인 과장 바뀌 워크숍 장소 못 들 소리 깜박 못 보내 보 알 차 타 오 해 늦 안 늦 나중 인사 평가 문제 되 알 가 최소 시간 이상 걸리 늦 같 문자 안 오 오 방법 없 착각 리 정확히 알 가 안 그러 그러 저 러 눈치 없 소리 듣 다니 눈치껏 움직이 눈치껏 늦 오 명 기다리 어 제 물어보 맞 맞 하 말 짓어 이제 하 말 없 사람 사기 만드네 진짜 얘 인성 대박이 애 믿 안 되 그 렇 그러 알리 고맙 팀 이상 구르 들어오 초반 알 늦 와 늦 되 각오
협박 대화,좋 말 하 빌리 돈 내놓 아직 월급 안 들어오 여윳돈 없 처음 이러 사람 화나 월급날 모르 알리 일 사람 이렇 지금 칼 들 원룸 앞 가 새끼 친구 살 지금 사람 하 소리 전화 끊 보 지금 차 돌리 가 잠깐 진 짜 오 지금 못 나가 여자 친구 있 상관 돈 받 가 지금 주머니칼 들 가 알 하 죽이 돈 안 주 경찰 신고 전 곱 밤 깊 하 지랄
협박 대화,잘 지내 잘 지내 치 잘 못 지내 죽 되 머 갑자기 왜 왜 그러기 그냥 기분 별로 죽이 원래 부 하 하 알 죽 머래 못 죽 몽둥이 가 죽이 괜찮 이러 마
협박 대화,과거 인터넷 글 올리 맞 잘 되 꼴 보 싫 글 올리 정신 나가 이제야 일 잘 풀리 그 렇 그러 죄짓 살 래 당하 지옥 느끼 돈 필요 돈 줄 글 내리 돈 글 올리 정신 차리 살 덜 떨 어 사람아 단단히 미치 글 못 내리 사람 쓰 강제 하 없 있 어쩌 조폭 부르 때 세상 없 일 알 금방 장기 팔 되 하 납치 바다 던지 되 잘못 죽 죄 잘못 사람 잘 못 죽 다시 평소 잘 나가 당연히 잡 가 잘 숨어 끝 쫓아가
기타 괴롭힘 대화,찐따 가 빵 좀 사 오 지금 우유 같이 돈 돈 사 인마 지금 돈 없 쭈 죽 미안
직장 내 괴롭힘 대화,일 오 보 아까 손 떠들 웃 아까 손 말 거 시 그냥 웃 웃 일 오 놀 오 하여튼 가보 일 제대로 하 말 안 하 참 가 식빵 모닝롤 단호박 빵 가져오 매니저 다시 말씀 있 되 하
기타 괴롭힘 대화,아가씨 시간 있 얼굴 이쁘 몸매 크 흐 자연 이쁘 칭찬 컵 넘나 넘 보이 같 데 시간 있 오빠 맛있 사 좋 곳 데려가 생각 있 저리 가 계속 그러 신고 이렇 튕기
직장 내 괴롭힘 대화,김수임 처리 똑바로 안 하 부장 동기 다 벌써 대리 과장 달 아직 주임 알 이렇 덜 떨어 지 앞 더 신경 쓰 다 대체 머리 모자라 학력 좋 뽑 회사 놀 오 쓰 놀이터 놀 애 데리 쓰 낫 아주 시정 대가리 있 생각 하 더 하 회사 다 때려치우
협박 대화,소문 내 다니 그렇 나오 안 되 소리 하 모르 이러 안 되 할머니 살 소리 강남 엄마 아빠 살 다 거짓말 확인 거짓말 할머니 죽이 계속 그렇 거짓말 미치 신고
갈취 대화,이사 사진 모르 이사 오 다 장인 어 른 덕 별것 없 출신 그룹 이사 되 다 데릴사위 팔리 되 소문 하 찍 중요 사모 개천 데려 오 계룡 만들 어리 여자 바람 피 말 사모 사진 보 슬퍼하 원하 눈치 빠르 좋 역시 그룹 이사 달 다르 원하 깜짝 지금 소리 지르 처지 본론 말 준비 건너가 삶 살 이사 조심 살 좋
갈취 대화,돈 얼마 있 물어보 대답 돈 없 시간 끌 내놓 천원 다예요 있 없 하 죽 앞 많이 가지 다니
협박 대화,별 핸드폰 이상 영상 있 노래방 아르바이트 영상 소리 남편 알 그렇 일리 없 영상 보내보 보 그렇 낫 라구 남편 보내 알 새끼 협박 죄야
갈취 대화,핸드폰 좋 보이 이번 새로 사 빌리 왜 새거 핸드폰 쓰 왜 학교생활 편하 싫 왜 그러 안 인마 빌리 말 많 맞 정신 차리
기타 괴롭힘 대화,지나가 여자 몸매 절 어너 보 여자 자보 소원 없 길 걸어가 대화 하 꼰대 이야기 하 같 여자랑 안 자 미치 가슴 작 얼굴 못생기 사람 가 이쁘 몸매 좋 칭찬 다 성희 롱 범죄 어 꼰대 랑 말 말 야 적당히 하 애 울
직장 내 괴롭힘 대화,김 선생 옷 예쁘 새로 사 감사 오늘 수업 시간 조 남학생 없 수업 잘 되 학생 집중 그렇 되 교감 선생 말씀 지 나치 보 좋 김 선생 걱정 그러 한참 예민 나이 애 문 제 정확히 말씀 고치 치마 기장 길 몸 붙 옷 색 야하 색 빨간색 뭡 교사 시대착오 생각 하 요즘 그렇 생각 사람 있 니 쯧쯧 교산리 학생 교산리 종업원 알 없 쯧쯧
기타 괴롭힘 대화,민주야 샌드위치 먹 집 아침 만들 먹 되 진짜 맛있 샌드위치 땅콩 샌드위치 땅콩잼 가득 들어가 땅콩 샌드위치 야 땅콩 먹 알레르기 생기 알 잖 오늘 약 안 가져오 말 켁 하 어머 진짜 반응 올라오 물 먹 금방 괜찮 약 먹 땅콩 못 먹 테스트 하 테스트 간이검사 하 긍정 생각 솔직히 지나 땅콩 알레르기 사라지 반응 보 아직 있 같 잘못 진짜 죽 지금 숨 쉬 힘들 땅콩 알레르기 진짜 심하 이렇 되 모르 어떡하 솔직히 별로 안 심하 지금 꾀병 부리 지 발 선생 신고 하 그러 안 그 럴
기타 괴롭힘 대화,어머 수지 남자 친구 다 만나 인사 남자 친구 최민기 대학 친구 김유리 안녕 유리 수지 남자 친구 안 멍하 민기 반 갑 역시 이수지 남자 절 대 안 끊기 되 벌써 이렇 멋지 사람 만나 민기 모르 얘 대학교 때 엄청 인기 많 남자 없 없 쓸데없 말 하 인기 많 더 많 기억 안 동아리 회식 취하 뻗 다들 데리 오빠 난리 해 민기 기분 나쁘 수지 인기 많 좋 그 괜찮 과거 연연 희 지금 너무 좋 어머 수지 이번 제대로 되 사람 만나 전 하 이제 남자 만나 지겹 하 애 조심 웃기 대학 남자 친구 빼 때 뺏 헤어지 뒤 소개 갑자기 왜 이러 눈치 없 그러 좋 소개 받 사귀 그러 못 그 정말 김유리 민기 먼저 가
기타 괴롭힘 대화,선생 싸우 때 눈 피하 미안 편 빨리 들어주 미치 미안 얻 맞 빠지 돈 앞 더 많이 가져가 편의점 가 오 새끼 웃기 틀리 말 하 오 까부 보소 용기 있 이제 인생 종 치
갈취 대화,잘못 내놓 받 모자라 장난 돈 내놓 옷 살 거 안 돈 없 미 친 잘못 다 소문 내버리 보 미안 사과 돈 하 집터 다 소 용없 진심 마련 거 지 코 붙이 어이 없 지금 용돈 다음 달 들어오 미안 진짜 짜증 지금 내놓 용돈 받 가져오
협박 대화,오랜만 잘 숨 다니 미안 돈 준비 말 듣 기다리 사정 있 걱정 마 돈 처리 정말 고맙 정말로 애 시키 다리 부러뜨리 처리 그만 소리 장기 빼내 최대한 잔인 고통 처리 죽이
기타 괴롭힘 대화,여성분 모이 하 모임 그러 이야기 나누 여성 주의 이야기 재미있 하 이야기 나누 이야기요 그냥 광범위 이야기 회의 하 회의 대표 이렇 사람 말 안 들어 페미니즘 하 이러 이렇 요즘 페미닌 즘 문제 경찰 부르
