class,khaiii_text
협박 대화,벌써 며칠 어서 말 자료 넘기 말 씀드리 접근 권한 없 칼 안 보이 당장 찌르 전 어서 하 정말 방법 모르 담당자 모르 알 허튼 수 작 부리 마 어차피 지금 못 받 죽 제발 목숨 살리 못 같 방법 찾아내 알
직장 내 괴롭힘 대화,임 대리 애인 있 없 이렇 예쁘 감사 몸매 예쁘 말 성희롱 칭찬 성희롱 그렇 예 잘리 딸 같 잘 사장
갈취 대화,용돈 다 떨어지 돈 좀 내놓 없 맞 정신 차리 제발 부탁 그러 피 맛 보 돈 주 말 같 무섭 돈 가져오 정말 돈 구하 없 돈 생기 때 좀 맞 살리 제발
직장 내 괴롭힘 대화,늘 왜 이렇 여우 굴 그치 느끼 실실 남직원 눈웃 음치 좀 보 그러 일 웃음 하 정말 같 여자 망신 저번 고백 차 이 정말 불여우 홀리 말 세 말세 얼 오 조용조용 오늘 머리 너무 이쁘 저녁 약속 있 감사 욕 모르 좋 좀 보
기타 괴롭힘 대화,오늘 옷 머 옷 새로 사 몸뚱이 어울리 몸 어떻 짪 굵 어울리 생각 그리 나쁘 너무 심하 얼굴색 이상 너무 구리 니 얼 굴 더 굽 려 머 정신 나가 머라 개 주둥이 닥치
기타 괴롭힘 대화,안녕 길 동 쇼핑몰 김수지 상담원 돕 이렇 전화 안 받 진짜 고객 불편 드리 문의 전화 너무 많 상담 지연 점 양해 부탁 드리 앉 전화 받 하 사람 그렇 바 쁘 그냥 띵 가 띵 놀 업무 고객 상담 들 절대 놀 다시 한 불편 드리 점 너무 쇼핑몰 시키 물건 이마 지 물건 컴플레인 전화 많 일부러 안 받 사람 돈 먹 그렇 놀 좋 이제 배부르 전화 개 받 그렇 처리 고객 갑 네 을 이 모르 고객 전화 너무 늦 받 다음 시정 맨날 하 알 말 그냥 물건 가지 집 앞 두 하 알 가져가 그렇 띵 가 띵 그 놀 집 가지 오 시간 있 반품 원하 고객 택배 기사분 보내 반송 택배 상자 다시 포장 집 앞 놔 가져가 확인 환불 다음 장사 생각 목소리 듣 살 직업 유 놀리 배짱 피우
기타 괴롭힘 대화,친구 지방대 다니 편하 학교 애 공부 안 하 술 먹 다 열심히 하 에 지방대 말 안 되 학교 무시 마 무시 입시 결과 안 좋 부실 대학 좋 학교 같 학교 보내 안 가 다니 하 말 하
갈취 대화,잘 들 회사 비밀 정보 다 있 원하 인출 정하 장소 가져오 그렇 크 돈 없 정보 다 흘리 되 간 주 하루 주 하루 정말 안 되 더 말 안 하 내일 다시 전화
기타 괴롭힘 대화,해 그림 그리 취 미 그러 그냥 즐기 취미 정 도 쉬 시간 고개 처박 하 그렇 이렇 열심히 하 치 별로 잘 못 그치 러 보이 기분 상하 현실 직시 따끔 말 반 친구 맞
기타 괴롭힘 대화,잠 깐 매일 왜 이러 전 하 말 없 좋 관심 없 오 만나 제발 이러 말 전 남자 친구 있 결혼 데이트 이 만나 스타일
기타 괴롭힘 대화,전화 안 받 미안 하 내일 학교 가 전 집 앞 와 라 오 가방 들 인마 인 마 친구 못 하 미안 힘 들 같 새끼 학교 보 미안
협박 대화,사과 먼저 욕하 어깨 치 가 어 리 놈 끼 싹수없이 말조심 얼 눈깔 똑바로 뜨 확 눈알 뽑 뽑 뽑아보 아주 어 리 놈 끼 가 못 뽑 알 겁대가리 없이 확 나이 먹 안 부끄럽 인마 건물 나오 보 조심 조심 조심 진짜 눈깔 뽑
기타 괴롭힘 대화,껍데기 정박아 태어나 주제 용케 아직 살 좋 아침 좋 같 덕분 존재 함께 모 두 어 민폐 끼치 그렇 생 각 생각 상관없이 잘 살아가 말 사실 시간 흐르 주위 사람 연민 바닥 보이 되 없 확실히 문 많 문제지 문제 말 괴롭히 이유 다시 말 몸 기억 못 하 같 불량품 자식 혈관 같 피 흐르 수치 견디 없 이쯤 되 목 메달 들 손목 긋들 어서 자살 손 더럽히 절 대 그 렇 없 형제여 삶 불사르 세상 대 되 가 후회 마
갈취 대화,떡볶이 사 싫 떡볶이 안 사 책 안 돌리 치 떡볶이 사 진작 그렇 책 꼭 돌리
협박 대화,지난번 말 좋 말 시키 하 왜 러 아무리 생각 하 없 같 새끼 못 칼 눈 신 장 떼 팔아넘 진짜 진짜 못 하 안 진짜 죽 알 시키 하 미치 분고 분 생각 죽 알 제발 살리
직장 내 괴롭힘 대화,김 병장 다음 주 휴가 머리 길 삭발 휴가 다음 주입 행보관 휴가 머리 길이 상관 있 다음 주 말 차 삭발 같 중대장 건의 명령 불복종 품위 유지 위반 징계 말차 잘 리 아 삭발 휴가 나가 래 행보관 같 그러 머리카락 그렇 기르 이발병 부르 삭발 시간 이내 안 오 말차 없 행보관 제발 이러 아 지금 열심히 군 생활 같 징계 받 되 삭발 오
직장 내 괴롭힘 대화,오늘 한식 먹 좋 좋 서사원 먹 먹 안 되 안 싫 잘못 있 수준 안 맞 수준 안 맞 하 에이 좀 많이 안 맞 전 따로 먹 식사 오
기타 괴롭힘 대화,애 오빠 잘생기 고맙 고맙 뭘 다르 오빠 만나 연결 좀 시키 오빠 여자 친구 만나 생각 없 알 마음 바뀌 있 싫 오빠 몸 금칠 연락처 좀 전달 연락 오 하 안 그러 알 쉽 쉽 가
기타 괴롭힘 대화,돈 갚 빌리 없 새끼 저번 빵 주 남 주 주 증인 있 다 봄 물건 받 돈 주 안 맞 정신 차리 잡 미안 내일 가져오 이미 늦 새끼 땀나 인건비 가져오 알 미안
직장 내 괴롭힘 대화,대리 자료 보내 있 자료 부족 알맞 보내 잘못 확인 확인 부족 자료 부분 있 자료 송부 부탁 드 립 알맞 보내 잘 확인 이렇 못 일 쯧 대리 확인 잘못 들어가 있 확인 말씀 드리 겁 알 있 가만 보 엄청 되 대리 아까 자꾸 무시 무안 주 같 해 이상 사람 만드네 잘못 알리 감사 니 하 일 모자라 성질 대리 서 넘 말 하 후배 배우 하 잔소리 선 넘 이렇 회사 생활
직장 내 괴롭힘 대화,듣 있 프로젝트 망치 엄청 깨지 원래 못 유명 안녕 다 있 노지리 지금 하 말 이번 실패 깨지 부장 어쩌다 같 들어오 진짜 너무 하
협박 대화,선생 관계 알리 조금 기다리 이야기 그렇 시간 벌 뒤 짓 하 다니 모 같 오 하 와이프 정리 기다리 아 더 이상 안 선택 선택 말 옆방 사모 모시 사모 선생 오늘 죽 되 선택 선생 사모 선택 선생 죽 따라가 선택 선생 사모 보내 생각 시간 주 있 좋 정확히 드리
갈취 대화,가지 돈 다 꺼내놓 정말 없 새끼 지갑 현금 없 이러 마 제발 신발 비싸 보이 이러 말 신발 벗 내놓 안 신 가 사정 맞 싫 내놓 제발 보
협박 대화,지금 하 꼼짝 손 들 그렇 같 딸 독약 주 안 딸 살리 말 들 지금 듣 있 물건 던지 두 보
협박 대화,오빠 헤어지 이제 별로 안 사랑 이제 지치 지치 대체 부분 지치 사과 사과 다시 사귀 잠깐 바뀌 다시 돌아오 싫 못 헤어지 헤어지 죽 어린애 싫 바뀌 오빠 먼 데 판단 진짜 해 가방 속 있 칼 손목 그러 마 그냥 좋 끝내 싫 진짜 죽 꼴 보 헤어지 죽 오빠 헤어지 생각 마 헤어지 확 손목 긋 죽
직장 내 괴롭힘 대화,길동 워크숍 못 오 워크숍 언 이번 주 금요일 이미 못 오 말씀 드리 왜 가 직원 길동 오 원하 눈치 좀 챙기세 사회생활 가
갈취 대화,아줌마 손 들 장바구니 장바구니 인건 알 듣 오늘 애 먹이 소 기 아줌마 미안 집 애 있 돈 없 소고기 좀 나누 먹 아줌마 옷 잘 입 보 있 보이 신랑 버리 가 연락 안 되 돈 없 주민 센터 같 연락 도움 좀 받 그 렇 주말 주민 센 터 여 보 굶 쭉 생기 가 아줌마 그냥 가 아줌마 집 쫓아가 집 앞 앉 애 기다리 기다리 하 하 그냥 가시 그냥 소고기 주 가
갈취 대화,지수 연극 학원 다니 돈 없 빌리 안 용돈 없 말 진짜 지수 진 짜 밥 사 먹 돈 없 말 정말 미안 진짜 돈 없 정말 돈 없 빌리 안 정말 미안 너무 친구 밥 못 먹 하 빌리 그렇 빌 이 싫 빌리 벼터 용돈 받 전 돌리 빌리 정도 하 있 알
기타 괴롭힘 대화,얘기 좀 하 어머니 왜 그러 보 보 집 오 왜 만 날 눕 어머니 지금 만삭 너무 힘들 그 렇 처음 보 주 너무 양심 없 몸 너무 힘들 그 렇 어머니 어제 출근 하루 종일 서 출근 정도 몸 상태면 집 설거지 정도 하 있 왜 그렇 도리 없 예의 없 어머니 기분 상하 진짜 혼수 안 하 몸 가지 시집오 처음 다 보 참자 참사 두 너무 나 그렇 기분 상하 모르 너무 동서 비교 서 집 오 얼마나 잘 알 니 어머니 동서 홀몸 고 만 삭 야 보 애 낳 알 임신 유세 어른 버 릇 없이 대들 어머니
갈취 대화,일루 저 오 돈 놓 가 돈 없 나오 무사히 집 못 진짜 없 아 죽 지갑 내 놓 내놓 있 아 곱 주 잘 가 재학 원비 돌려주 안 되
직장 내 괴롭힘 대화,부장 이번 달 말 연차 사용 연차 일 이번 부모 모시 여행 다녀오 부모 여자 친구랑 가 이번 아버지 환갑 환갑 잔치 가족 여행 어 요즘 환갑 환갑 이렇 바쁘 시기 꼭 빠지 지난달 야근 알 이번 주 프로젝트 끝내 월말 팀 여유 생기 겁 보 상 치르 알 회사 이렇 바쁘 휴가 가 어 요즘 젊은이 부장 되 암튼 모르 자리 돌아가
직장 내 괴롭힘 대화,퇴근 퇴근 퇴근 퇴근 벌써 일주일 두시 넘 들어가 집 꿀 바르 놓 집 가 자식 고참 퇴근 안 하 먼저 도망가 김 과장 야간 근무 새끼 또박또박 말대꾸 대가리 박
협박 대화,그냥 죽 하 한국 남자 그러 그러 그냥 죽 죽 전 이유 들 그러 한국 남자 여자 강간 노예 부리 폭행 성 노예 적어도 사람 똑같 남자 다 변명 듣 싫 그냥 칼 죽 그러 진짜
직장 내 괴롭힘 대화,대리 커피 사 법가 받 있 법 카로 대리 카드 사 지 상사 커피 사 싫 사 오 아이스 아메리카 노 사 오 갑 라테 먹 다시 사 오
직장 내 괴롭힘 대화,이번 주 출장 부산 가 교육 받 바쁘 꼭 가 직무 관련 법 개정 관련 출장 꼭 가 같 책 받 금방 일 있 그날 너무 자리 자주 비우 같 지난주 휴가 쓰 어머니 모시 병원 가 이유 어쨌든 너무 자주 비우 윗분 안 좋아하 잘 생각 결정
기타 괴롭힘 대화,사장 일 신 음식 머리카락 나오 말씀 안 보이 진짜 위생 어떻 되 똑바로 안 하 고객 제조 머리 올리 머 넣 말 이상 되 지금 빨리 환불 더럽 못 먹 환불
협박 대화,조국 배신 말 똑바로 하 조국 하 없 고아인 기회 주 키우 조국 키우 하 어리 시절 지옥 같 조국 은혜 보답 은혜 웃기 이렇 하 이유 사랑 사랑 같 소리 하 이빨 뽑 이러 해결 문제 조용히 하 버튼 누르 안 그 알 사람 다 반병신 되
직장 내 괴롭힘 대화,과장 요청 문서 작성 이제야 가져오 말씀 시간 작성 완료 정도 퀄리티 이렇 오래 걸리 쓰 더 노력 입사 차 보다 입사 되 최 사원지 더 잘 하 노력 잘리 겐 다음 달 정리 해고 알
협박 대화,비행기 위급 환자 생기 과다출혈 피 부족 상태 오 헌혈 부탁 드리 보호자분 환자 혈액 형 형 승객분 안내 환자 혈액 형 탑승객분 형 형 헌혈 부탁 드리 의료진 있 제발 안심 오 동생 죽 이러 형 이기 빈혈 있 괜찮 빈혈 있 위급 상황 생기 대처 못 하 가능 같 안 계시 형형 없 없 빨리 안 나오 피 다 뽑 죽이 전 빨리 나오 분 동안 안 나오 앞 있 애 죽이 보호자분 진정 겁나 못 하 있 제발 진정 그렇 해결 없 일부러 안 오 딱히 해결 방법 없 제발 진정 칸 가 더 찾아보 제발 제발 진정 되 칸 형 나오 다 죽이 피 방울 안 나오 때 싹 말리 죽이 비행기 창문 깨 다 죽 만들
기타 괴롭힘 대화,아씨 빨리 비키 미안 빨리 비키 거슬리 자꾸 알짱거리 미안 다리 불편 다리 불편 나오 나오 남 피 하 다리 불편 집 치 박히 미안 생각 있 아휴 장애인 나머지 다리 불편 전 빨리 비켜
협박 대화,저번 말 물건 준비 선생 시간 조금 더 주 저번 그 렇 이번 그냥 안 넘어가 원래 준비 하 더 요구 과 하 진짜 과 하 보이 와 이프 자식 장기 팔 준비 직접 하 오늘 꼭 갚
협박 대화,돈 갚 미안 다음 달 기다리 벌써 더 기다리 기다리 하 제발 믿 기다리 없 정말 미안 다음 달 꼭 갚 좋 말 하 우습 보이 더 못 기다리 갚 정말 돈 없 사정 달 보내 안 그러 못 걷 하 알 이번 달 시 간 너무 촉박 시간 더 필요 더 안 기다리 말 못 걷 알
협박 대화,감히 아빠 죽음 몰 가 민재야 제발 미안 살리 술 안 먹 운전 안 하 아빠 살 미안 너무 생각 짧 그 의사 잖 닥치 살 있 병원 오 안 되 평생 반성 속죄 살 살리 친구 친구 이미 널 전 없 사람 생각 하루하루 아빠 생각 죽 같 지금 치료 안 받 죽 모르 이제 드디어 아빠 복수 하 있 잘 가 약 고통 없이 가 최소한 배려 민 민재야 제발 윽
갈취 대화,오늘 쏠 비싸 먹 잘 먹 잘 먹 어쩌 지갑 안 갖 오 또 살 비싸 먹 내 되 저번 그렇 아직 안 주 살 그 러 있 친구 그렇 돈 있 만 꼭 주 되 사람 이상 만 드 안 주 하 열 받 좋 말 하 말 안 듣 무섭
기타 괴롭힘 대화,수행 평가 해와 손 빠르 머리 좋 금방금방 하 거잖 모르 시간 걸리 같 해 말 하 이유 있 그냥 내켜 시키 말 많 여자 애 당하 후 알
협박 대화,송아지 넘기 하 이제 오 말 옆 마을 하 더 비싸 치 하 사람 약속 있 약속 먼저 하 돈 궁 하 그 미안 하 미 안 하 하 단가 어쩌 무릎 꿇 빌 진짜 적반 장 이대로 물러나 같 안 그러 어쩌 송아지 못 팔 지금 낫 로 막 찌르 죽이 불 거구만 가 만 있 알 집 소 다 죽이 불 거구만
협박 대화,오랜만 오랜만 이렇 사이 많이 크 어리 때 많이 맞 주제 그때 당하 지금 몸 밖 쓰 모르 깡패 주제 새끼 말본새 보 하 보 오늘 더 제삿날 알 제삿날 좋아하 그렇 나오 경찰 부르 경찰 가 아주 재미있 있 좋 경 찰 경찰 알 사람 있 금방 빠져나오 금방 빠져나오 금방 빠져나오 언론 이용 생각 재미있 언론 새끼 그러 눈 깜짝 같 이렇 입 놀리 쥐 새 모르 죽 있 지금 다 녹음 부 증거 증거 모으 기사 내 알 사람 지키 두
협박 대화,돈 빌리 가 갚 갚 갚 지금 죽 생기 미안 되 자금 막히 다 필요 없 콩팥 떼 왜 친구 정신 차리 리 죽 생 기 그러 미안 같이 가세 얼른 마련 조금 기다리 더 이상 못 믿 콩팥 떼 정리 미안 하
협박 대화,남자 하 더 맞 그렇 때리 말 하 지금 말 하 생기 그러 마 오해 거짓말 더 맞 자꾸 경찰 부르 경찰 오 전 죽이 알 오해 말 기억나 세세히 말 기다리 시끄 넌 찍히 어쩌 진짜 지금 자리 죽이 살리
기타 괴롭힘 대화,바보 모르 모르 있 다 다 알 풀 있 아직 안 배우 모르 병 신 아 요즘 학원 다 배 워 맞 집 거지 학원 못 가 거 따르 하 마 따르 하 마 지랄
기타 괴롭힘 대화,되 같 제발 해 잘못 새끼 좀 닥치 하 시비 좀 그만 걷 오 늘 뒤지 닥치 새끼 오늘 조지 많이 크 저리 가 제발 제발 새끼 다 시 말 못 하 조지 오늘 뒤지
직장 내 괴롭힘 대화,과장 이사 골프 부킹 하 운동 한 하 골프 안치 배우 하 때 이사 골프 치 밤새 연습 전혀 골프 취미 없 되 무 주말 수원골프 장 타임 부킹 하 새벽 데리 오 주말 아버님 칠순 고향 내려가 승진 안 하 만년 과장 보 부모 기분 퍽 좋 무조건 부킹 하 데리 오
갈취 대화,가방 좋 보이 나 주 안 며칠 빌리 싫 아끼 거 교환 쓰 마음 들 사 쓰 돈 없 쓰 안 주 안 같 말 안 듣 각오
갈취 대화,야야 배고프 매점 가 빵 좀 사오 돈 주 사 올 사이 왜 러 사 주 흠 돈 없 배고프 화 나 기 전 빨리 사와 진 짜 돈 없 용돈 받 있 다 알 비상금 다 쓰 사 줄 이번 사주 진짜 마지막
직장 내 괴롭힘 대화,내일 일 있 휴가 쓰 휴가 내일 나오 집 가보 하 없 직장인 휴가 주말 가 되 휴가 쓰 가 하 내일 하 일 있 그렇 진작 하 갑자기 휴가 쓰 하 회사 돌아가 잘 하 회사 장난
직장 내 괴롭힘 대화,오늘 회식 빠지 알 오늘 어머니 생신 회사 뒷전 말 그렇 안 보 이기 회사 애 장난 빠지 빠지 출근 하 마 참석 구걸 같 하여간 요즘 신입 저러 모르
협박 대화,벌 말 조심 사정 다 하 없 죽 말 경고 앞 조심 얘기 이제 다 소용없 더 기회 주
협박 대화,그렇 모르 갑자기 그러 모르 물 이유 말씀 알 칼 찔리 정신 차 리 래 친구 소문 퍼 트리 다니 사실 사실 얼굴 못 들 다니 미안 이유 없 죽이 사실 칼 가져오 미안 미안 말 사람 죽이 있 알 칼 똑같이 죽이 잘못 일 오 아 칼 쑤시
갈취 대화,지금 차비 없 돈 좀 주 돈 없 학생 학생 부모 전화 빨리 갖 오 알 고맙 돌려주 싫
직장 내 괴롭힘 대화,장 팀장 눈 우스 보 말씀 김 대리 불 하 그렇 꼽 우 표정 오해 있 같 오해 김 대리 못 소리 하 말 우습 아주 그냥 직장 상사 지 아래 보 보 되 알 일개 팀장 나부랭이 아주 그냥 과장 보 우습 알 오 오해 개뿔
협박 대화,영상 올리 사전 동의하 목소리 나가 말씀 드리 동의 되 웃기 주변 사람 보 젓 물어보 지금 리 영상 다 사전 동의하 올리 겁 니 미리 인지 내려주 그렇 하 없 영상 다 올라가 지금 올리 영상 내리 없 안 내리 카 톡 대화 캡처 커뮤니티 올리 개인 정보 보호 수장 하 대화 차단 겁 차단 새끼 사람 알아보 날 살 알 찾아가 죽이 야
협박 대화,돈 갚 금방 갚 기다리 안 원래 돌려 하 기간 벌써 지나 다음 달 월급 타 줄 또 잔 고작 없 돈 빌리 일 갚 주제 말 심하 더 심하 말 다음 달 안 주 이빨 다 뽑 알 갚 명심 마지막 경고 진짜 갚 마지막 양해
기타 괴롭힘 대화,출출 라면 먹 저렇 라면 먹 살찌 배고프 먹 그만 먹 살 출렁거리 보 건강 소리 관리 야지 운동 잘 뚱뚱 운동 운동 뚱뚱 진짜 돼지 거짓말 하
갈취 대화,일 오 보 왜 왜 오 새끼 돈 있 생기 진짜 돈 없 뒤지 나오 뒤지 그러 안 새끼 돈 많 신발 벗 제발 하 죽 놓 이러
갈취 대화,앞 매일 책상 위 스타벅스 샌드위치 올려놓 알 목소리 하 싫 알 앞 대답 때 크 소리 말 알 샌드위치 올려놓 되 응응 목 마르 가끔 마시 꼭 올리 놓 알 매일 부담 있 같 알 학교생활 어렵 두 보 알
갈취 대화,핸드폰비 밀리 내주 좋 얼마 전 적금 타 건드리 안 되 적금 내일 끊기 주 그러 모르 사람 내주 지 내주 끊기 이번 마지막
기타 괴롭힘 대화,약속 알 일 어머 톡 방 없 톡 방 모임 톡 방 없 모르 애 말귀 못 알아듣 빼 보 모르 유명 너무
직장 내 괴롭힘 대화,지금 차 내리 미치 놈 카페 있 회장 지금 회의 가 시간 참 최고 카페 알아보 모시 드리 진드기 같 이 대꾸 말 안 들리 귀먹 회장 회장 회의 참석 안 하 해고 제발 그렇 참 벌레 해고 말 상관 지금 진 짜 귀 먹 지금 해고 카페 운전
기타 괴롭힘 대화,깜짝 인 놀라 멀 놀라 놀라 일 놀라 때리 마 멀 때리 그냥 부르 난 아프 힘 들어가 아프 보 울보 멀 지금 말 울 승민이 울보 울보
기타 괴롭힘 대화,이름 길 말자 얘 이름 말자래 개 이름 아 짖 손 놀리 마 개 말 하 아 간식 주 되 냐 마이쮸 가 묻 오
직장 내 괴롭힘 대화,민지 보 다리 예쁘 감사 부장 엉덩이 살 있 여자 엉덩이 실 애 잘 낳 안 부장 대화 불편 칭찬 불편 지 사회생활 안 되 몸 대하 얘기 안 하 좋 민 그렇 안 보 꽉 막히 사람 그렇 생각 상관없 적어 최소한 매너 지키 민 지 편의 보 알 지금 편하 일 덕분 알 항상 열심히 일 정수기 물 가 비품실 쌓이 재고 정리 지금 하 뒤 회의 있 후 하 말 듣 지금 하
갈취 대화,학생 일 오 보 왜 돈 있 없 거지 뒤지 나오 한대 원 이번 주 차비 제발 가져가 차비 없 서 말 그냥 다시 부모 다르 집 진짜 가난 돈 없 돈 없 미안 제발 돌려주
직장 내 괴롭힘 대화,이렇 하 하 안 하 저번 선배 설명 하 장난 언제 이렇 하 하 머리 장 식 착각 보 다 정말 답 답 죽 짓 하 오늘 다 하 전 집 못 가 말 못 하 앞 실수 안 하
기타 괴롭힘 대화,민수야 왜 이렇 못생기 못 생 기 민수야 왜 이렇 못생기 키 작 못 생기 머 애 들 민수 진짜 못 생기 기철 제발 못생기 놀리 마 못생기 애 보 못생기 그러 머 그러 기철 자꾸 못생기 놀리 마음 아프 정말 너무 못생기 나중 연애 한 하 평생 솔로 살 기 철 제발 만
협박 대화,김 사장 내일 돈 갚 하 날 알 박 사장 알 며칠 더 연기 하 김 사장 장난 하 급하 빌리 때 이제 오 미루 하 정말 면목 없 만 더 기한 주 같 소리 하 돈 못 갚 같 팔 자르 보험료 받 무섭 말씀 돈 못 갚 하 돈 구 하 박 사장 최대한 빠르 구하 되 이기회 정신 차리 없 달라지 못 하 도와주 박 사장 어떻 일주일 안 구하 기다리 일주일 일주일 안 못 갚 절단 알 알
기타 괴롭힘 대화,최민기 핫스폿 끄 달 데이터 다 끝나 끄 못 쓰 빨리 다시 안 켜 미안 엄마 요즘 휴대폰 요금 너무 많이 나오 알 둘러대 사정 화나 빨리 키 데이터 없 데이터 다 쓰 키 있 모르 렇 달 엄마 자꾸 이러 휴대 폰 없애 하 때가 생각 일 빨리 지금 키 이기 진 짜 미치 알 지금 킬
직장 내 괴롭힘 대화,최인턴 간식거리 탕비실 정리 알 주임 고맙 맞 최인턴 거 정리 탕비실 밴드 지 주 아까 손 다치 밴드 먼저 가지 다드 더 좋 역시 차 인턴 일 빠르 잘 한 말 그렇 잡일 부탁 잘 하 아직 업무 많이 어렵 일 도통 못 맡기 아직 제대로 주 일 없 원래 다 인턴 믿 없 말 차 인턴 제대로 일 하 보 없 말 앞 잘 부탁 주임 시키 잘 있 본인 더 잘 알 같 정리 좀 부탁 다르 일 너무 많 이만
기타 괴롭힘 대화,우 아 이번 올라오 사진 정말 예쁘 고맙 사진 보고 입 옷 립스틱 사고 제품 알리 있 정말 좋아하 따르 하 사진 찍 제품 우 오 너무 비싸 같 어차피 사진 찍 다 빌리 안 빌리 빌리 전전 피드 올리 옷 빌리 사촌 언니 이미 빌리 못 빌리 같 진 짜 너무 언니 얼른 다시 받 빌리 안 엄청 착하 믿 되 지 알
기타 괴롭힘 대화,듣 선생 수업 실습실 어 제 개 웃기 진짜 미치 완전 크크 얘 말 듣 씨발 매우 싫 하 말 한말 아냐 헤헤 크크 개 웃기 크크 벙 찌 말 듣 실습실 가 먼저 가 기다릴 크크 씨발년 더럽 떽 떽대 혼 좀 내주 그러 진 짜 왕따 취급 보이
협박 대화,사 이 코 새끼 돌 사람 죽 일일 있 새끼 감방 치 안 미친 그러 하 그러 예요 새끼 있 경찰 부르 새끼 오늘 죽 죽이 나 잘못 없 짓 안 하 사람 나쁘 죽이 죽 싫 새끼 토끼 오늘 뒤지 정신 차리 새끼
직장 내 괴롭힘 대화,일주일 동안 시간 동안 고작 이 못 쓸 모없 새끼 음 없 꺼지 꼴 보 싫 까 팀 굴 들 오
갈취 대화,회색 교복 치마 입 아기 이리 젓 말 있 부르 언니 빵 사 돈 없 주 래 현금 없 모르 얼른 주 진 짜 카드 있 보이 얼른 뽑 기다릴 빨리 와
갈취 대화,찐따 담배 사 오 용돈 부족 미안 미치 요즘 덜 맞 진 짜 진짜 미안 다음 주 꼭 살 되 오늘 가지 돈 좀 다 내놓 용돈 부족 돈 지금 없 직접 뒤지 정말 믿 제발 가방 턴다 내놓 흑흑 정말 미안
협박 대화,죽 환장 지금 치 가 실수 부딪히 눈 달 다니 아씨 어깨뼈 분지르 지 같 설마요 지금 짓말 하 보이 살짝 부딪히 거짓말 같 어깨 조각조각 내주 심정 알리 나
협박 대화,똑바로 있 아저씨 살리 시 끄 불구 되 다행 생각 살리 하 제발 살리 싫 살리 신고 살 자격 없 저 제발
협박 대화,면상 재수 없 눈 띄 마르 하 미 미안 미안 다 고개 푹 숙이 다니 땅 한번 하 고개 푹 숙이 개 기 왜왜 왜 그러 처 맞 래 그냥 하 래 그렇 잘못 생기 재수 털리 빨리 숙이 새끼 시 싫 싫 지금 처 맞 네발 기어가
직장 내 괴롭힘 대화,김 대 리 과장 오늘 커피 좀 쏘 날 덥 힘내 좀 커피 사지 업무 능력 부족 동료 미안 말 하 네 바로 사 오
협박 대화,아들 딸 학창 시절 지옥 만들 마지막 사진 잘 보 다 잘못 아들 살리 되 자식 살리 감정 태도 있 딸 미 자살 꼭 식 풀 직성 풀리 아들 건들 하 미치 아줌마 이제 말 안 하 학폭 딸 자살 새끼 아들 건들 감옥 서 평생 썩 알 경찰 신고 하 안 그 렇 생각 그냥 아들 낳 죄 나 반성 아주 그냥 장례 못 치르 만들 대 체 그러 다 아들 교육 못 시키 죄 똑같
기타 괴롭힘 대화,맨 날 이상 화장 그러 남자 애 안 좋아하 남자 애 잘 보이 화장 그냥 화장 좋 소리 남자 인기 많 의식 주제 얘기 나오 화장 다니 다니 쪽팔리 얼굴 남자 애 말 걸 거 기분 쁘 안 보이 없 착각 소리 좋아하 꼬 리 치 썸 깨지 먼 역시 너 뒤 짓 하 다니 실망 이제 그만 얘기 아직 얘기 안 끝나 마음 안 들 말 정신 차리
